Date,Category,Insight,Impact on Momentum Prediction,Priority,Status,Next Steps,
12/19/2024,Feature Engineering,Shot feature contains x,y coordinates for shot location on pitch,High - shot location critical for momentum shifts and goal probability,High,Identified,Extract coordinates for spatial analysis
12/19/2024,Feature Engineering,Block feature has multiple types with descriptions and true/false options,Medium - blocking patterns may indicate defensive momentum,Medium,Identified,Analyze block types and create categorical features,
12/19/2024,Data Quality,Binomial features only have true values and missings - missings appear to represent false,High - affects feature encoding strategy for momentum prediction,High,Identified,Treat missings as false for binomial features,
12/19/2024,Data Quality,Event columns with missing values represent events that did not occur at that moment - not true missing data,High - changes feature engineering approach for event-specific features,High,Identified,Consider event occurrence flags instead of detailed event data,
12/19/2024,Data Quality,Related_events missing values represent 0 related events - not actual missing data,Medium - affects related events encoding strategy,Medium,Identified,Encode missing related_events as 0,
12/19/2024,Feature Selection,"21 variables have 96.66-100% missing rates - likely we will  combine them into one variable, in order not to lose information.",High - reduces feature space and improves model efficiency,High,Identified,Remove high-missing event-specific features or create occurrence flags,
12/19/2024,Data Quality,99.54% events have player involvement - need to verify,Medium - affects player-based momentum analysis strategies,Medium,Identified,Verify if 0.46% non-player events are valid or data quality issues,
12/19/2024,Data Quality,Duration - need to check the missings + outliers,Medium - 27.48% missing + 6932 outliers (max 35.96s) affect event timing analysis,Medium,Identified,Investigate duration outliers and missing patterns for momentum timing,
12/19/2024,Data Quality,Away score - check outliers,Low - 16736 events with score=3 may be unusual but could be valid high-scoring games,Low,Identified,Review high away scores (3 goals) for data validation,
12/19/2024,Tournament Dynamics,Group Stage Matchday 1: Attacking spectacle (2.83 goals/game 8.3% draws),High - early tournament phase shows aggressive momentum patterns for modeling,High,Identified,Use Matchday 1 patterns as baseline for attacking momentum,
12/19/2024,Tournament Dynamics,Group Stage Matchday 2: Tactical balance (2.25 goals/game 50% draws),High - mid-tournament adaptation shows balanced momentum states,High,Identified,Model tactical adjustment patterns in momentum prediction,
12/19/2024,Tournament Dynamics,Group Stage Matchday 3: Cautious qualification (1.67 goals/game 58.3% draws),High - final group stage shows defensive momentum with qualification pressure,High,Identified,Factor qualification pressure into late-stage momentum models,
12/19/2024,Disciplinary Patterns,"Yellow cards escalate across group stage matchdays: games 1 - 0.33 , games 2 - 1.17, games 3 - 1.58",Medium - disciplinary pressure increases momentum tension as stakes rise,Medium,Identified,Include matchday progression effects in momentum models,
12/19/2024,Tournament Structure,Round of 16 and Quarter-finals frequently go to extra time (25% and 75% respectively),High - requires normalization to 90 minutes for fair statistical comparison,High,Identified,Use normalized per-90min statistics for knockout stage momentum analysis,
12/19/2024,Data Normalization,Extra time significantly impacts knockout statistics: Quarter-finals goals drop 20% when normalized (2.00 - 1.60 per 90min),High - affects momentum model training on knockout vs group stage data,High,Identified,Apply time normalization in feature engineering for knockout rounds,
12/19/2024,Shot Statistics,"Tournament total: 1340 shots with clear outcome distribution - On Target: 557 (41.6%) - Goals: 126 (9.4%), Saved: 316 (23.6%); Off Target: 397 (29.6%); Blocked: 386 (28.8%)",High - shot outcome distribution critical for momentum shift prediction and goal probability modeling,High,Identified,Use shot outcome patterns as momentum indicators and goal prediction features,
12/19/2024,Tournament Dynamics,Semi-finals showed significant shot decrease (>50%) but only 2 games - small sample size limits statistical confidence,Medium - late tournament fatigue or defensive tactics but insufficient data for reliable modeling,Medium,Identified,Consider semi-final patterns with caution due to small sample size,
12/19/2024,Tournament Dynamics,Round of 16 + Quarter-finals show 8-16% increase in shots compared to group stage,High - knockout pressure increases attacking intensity which affects momentum patterns,High,Identified,Model increased attacking aggression in knockout rounds for momentum prediction,
12/19/2024,Data Quality,"Duration missing values: ALL 51,618 missing duration values are Ball Receipt* events (100% match), and ALL Ball Receipt* events have missing duration (100% missing rate)",High - confirms missing duration should be treated as 0 for Ball Receipt events which are instantaneous,High,Identified,"Replace missing duration with 0 for Ball Receipt* events, as they represent instantaneous ball reception",
12/19/2024,Period Analysis,"First half has 5.9% more total events (93,628 vs 88,447) but second half has 19% more goals (58 vs 47) and 18.2% more shots (694 vs 568)",High - period effects show different momentum patterns with second half being more clinical and direct,High,Identified,Include period as feature and model different momentum-goal relationships for each half,
12/19/2024,Tactical Patterns,"Massive substitution difference between halves: Period 1 (6 subs) vs Period 2 (443 subs) - 98.6% increase, plus yellow cards jump from 9 to 42",High - tactical changes and disciplinary pressure create momentum shift opportunities primarily in second half,High,Identified,Model substitution and card events as momentum shift triggers especially in second half,
12/19/2024,Event Hierarchy,"Major events (Pass, Ball Receipt*, Carry) dominate first half while minor/reactive events (Ball Recovery, Block, Shots, Fouls, Clearance) rule second half - shows transition from possession to result-oriented play",High - momentum character fundamentally changes between halves requiring different weighting schemes for possession vs reactive events,High,Identified,Create separate momentum models for possession-based (first half) vs reactive-based (second half) momentum patterns,
12/19/2024,Period Statistics,"Period 1: 93,628 events, 47 goals, 568 shots, 9 yellow cards | Period 2: 88,447 events, 58 goals, 694 shots, 42 yellow cards - second half more efficient with 23% higher goal-to-shot ratio (8.4% vs 6.5%)",High - quantifies second half efficiency and intensity increase for momentum modeling calibration,High,Identified,Use period-specific conversion rates and intensity metrics as momentum model features,
12/19/2024,Halftime Analysis,Halftime results: 52.9% draws (27 matches) vs Full-time: 33.3% draws (17 matches) - 41.2% matches (21/51) changed results between HT-FT with 58.8% maintaining same result,High - shows momentum shifts are frequent and predictable patterns exist for when results change vs maintain,High,Identified,Model halftime result state as strong predictor for second-half momentum direction and result change probability,
12/19/2024,Momentum Patterns,Late Winner pattern: 14 matches (27.5%) from draws to wins | Equalizer pattern: 4 matches (7.8%) from leads to draws | Average goals: HT 0.92 vs SH 1.37 (49% more productive second half),High - specific momentum patterns show predictable pathways for result changes and goal timing distribution,High,Identified,Create momentum pattern classifiers for Late Winner vs Equalizer scenarios and weight second-half events higher in goal prediction,
12/19/2024,Goal Difference Distribution,Halftime: Draw 27 (52.9%) vs 1-goal 21 (41.2%) | Full-time: Draw 17 (33.3%) vs 1-goal 20 (39.2%) - dramatic decrease in draws (-10 matches) with games becoming more decisive,High - shows how momentum shifts create separation and predict final outcome margins,High,Identified,Use halftime goal difference as momentum predictor for final margin and model draw-to-win transition patterns,
12/19/2024,Goal Difference Statistics,Average goal difference: HT 0.57 vs FT 1.08 (+0.51 increase) | Median goal difference: HT 0.0 vs FT 1.0 (+1.0 increase) - 89% increase in average separation by game end,High - quantifies momentum's impact on competitive separation and outcome certainty progression,High,Identified,Model goal difference progression as momentum accumulation metric and separation predictor,
12/19/2024,Stage Competitiveness,"Round of 16 = Most Decisive: 50% of matches had 2+ goal margins (avg 1.62 goal diff) - teams either advanced convincingly or were eliminated decisively, highest separation of tournament",High - Round of 16 creates clearest momentum differentiation requiring separate modeling approach for decisive vs competitive stages,High,Identified,Create stage-specific momentum models with Round of 16 as decisive separation benchmark,
12/19/2024,Stage Competitiveness,"Quarter-finals = Most Competitive: 100% close games (0-1 goal), 75% went to extra time, highest draw rate at halftime (75%) - ultimate test of momentum with minimal margins",High - Quarter-finals represent peak momentum sensitivity where smallest shifts determine outcomes requiring fine-tuned momentum detection,High,Identified,Develop high-sensitivity momentum models for Quarter-final-level competitiveness and extra time prediction,
12/19/2024,Stage Competitiveness,Later Stages = 1-Goal Drama: Semi-finals and Final had 100% 1-goal margins - ultimate competitiveness with no decisive victories beyond Quarter-finals,High - Final stages show momentum becomes determinative rather than separative requiring models focused on momentum direction not magnitude,High,Identified,Design momentum direction classifiers for final stages where magnitude matters less than timing and direction,
12/19/2024,Tournament Progression,"U-Shaped Competitiveness: Competition decreases in Round of 16 (50% decisive), peaks in Quarter-finals (100% close), then becomes consistently tight in Semi/Final (100% 1-goal)",High - Tournament structure creates predictable competitiveness patterns requiring stage-aware momentum modeling with different sensitivity levels,High,Identified,Implement stage-progressive momentum sensitivity scaling that adapts detection thresholds based on tournament progression and expected competitiveness,
12/19/2024,Group Stage Evolution,Matchday 1 = Most Decisive: 1-Goal Games 6 (50.0%) + 2+ Goal Margins 5 (41.7%) - opening attacking spectacle with highest separation and 2.83 goals/match,High - Matchday 1 requires momentum models optimized for high-scoring decisive games with clear attacking patterns and early tournament aggression,High,Identified,Develop attacking-momentum models for Matchday 1 with higher goal-scoring thresholds and decisive separation detection,
12/19/2024,Group Stage Evolution,Matchday 2 = Tactical Balance: 1-Goal Games 2 (16.7%) + 2+ Goal Margins 4 (33.3%) - 50% draws showing strategic calculation and adaptation phase,High - Matchday 2 represents equilibrium requiring balanced momentum detection for both attacking and defensive tactical adjustments as teams assess qualification scenarios,High,Identified,Create balanced momentum models for Matchday 2 accounting for tactical adaptation and qualification pressure effects,
12/19/2024,Group Stage Evolution,Matchday 3 = Most Competitive: 1-Goal Games 4 (33.3%) + 2+ Goal Margins 1 (8.3%) - ultra-cautious with 91.7% close games and only 1.67 goals/match for qualification survival,High - Matchday 3 demands highest momentum sensitivity for minimal-margin games where qualification pressure creates extreme competitiveness and defensive tactics,High,Identified,Design high-sensitivity momentum detection for Matchday 3 survival scenarios with qualification pressure modeling and defensive momentum patterns,
12/19/2024,Group Stage Progression,Linear Competitiveness Increase: Decisive games decline 41.7% -> 33.3% -> 8.3% while close games increase 58.3% -> 66.7% -> 91.7% across matchdays showing perfect tactical evolution,High - Group stage creates predictable momentum sensitivity progression requiring matchday-specific calibration from attacking spectacle to survival mode,High,Identified,Implement progressive momentum sensitivity scaling across group stage matchdays that adapts from decisive to ultra-competitive detection thresholds,
12/19/2024,Goals Distribution,0 goals: 6 matches (11.8%) = 100% draws - perfect draw predictor when no goals scored creating mathematical certainty of tied outcome,High - 0-goal matches provide perfect momentum stalemate baseline for modeling defensive equilibrium and momentum neutralization patterns,High,Identified,Use 0-goal games as momentum neutrality reference point and model conditions that lead to complete offensive cancellation,
12/19/2024,Goals Distribution,1 goal: 7 matches (13.7%) = 100% decisive - single goal always determines winner with no possibility of draw due to mathematical impossibility of equal split,High - 1-goal matches demonstrate pure momentum effectiveness where minimal scoring creates maximum outcome determination requiring precision momentum detection,High,Identified,Model 1-goal scenarios as momentum efficiency benchmarks where single decisive moments determine entire match outcomes,
12/19/2024,Goals Distribution,2 goals: 15 matches (29.4%) = Most common distribution with 66.7% draws (10/15) - represents tournament's draw sweet spot where goals can be split equally,High - 2-goal matches are the primary draw scenario requiring momentum models to detect when scoring will balance out vs create separation,High,Identified,Develop 2-goal momentum balance detection to predict when teams will split goals evenly vs one team dominates both scores,
12/19/2024,Goals Distribution,3 goals: 16 matches (31.4%) = Most frequent total with 100% decisive outcomes - mathematical impossibility of draw creates guaranteed winner in highest-volume scenario,High - 3-goal matches represent tournament's most common decisive pattern requiring momentum models optimized for moderate-scoring definitive outcomes,High,Identified,Optimize momentum detection for 3-goal scenarios as the primary decisive game type and model conditions favoring moderate-scoring definitive results,
12/19/2024,Goals Distribution,4+ goals: 7 matches (13.7%) = High-scoring games with 4 goals (25% draws) vs 5-6 goals (100% decisive) showing threshold where volume overwhelms balance,High - High-scoring games show momentum escalation patterns where volume creates either spectacular draws or overwhelming dominance,High,Identified,Model high-scoring momentum dynamics to distinguish between balanced offensive showcases vs momentum snowball effects that create lopsided results,
12/19/2024,Mathematical Pattern,"Odd-Even Goal Rule: Odd totals (1,3,5,6) = 100% decisive vs Even totals (0,2,4) allow draws - mathematical constraint determines outcome possibility based on divisibility",High - Goal total parity provides mathematical framework for momentum modeling where even goals enable balance while odd goals guarantee separation,High,Identified,Integrate odd-even mathematical constraints into momentum models as fundamental outcome probability framework based on goal accumulation patterns,
12/19/2024,Tournament Scoring,Goal Volume Distribution: Low-scoring (0-1) 25.5% vs Medium-scoring (2-3) 60.8% vs High-scoring (4+) 13.7% - tournament character defined by moderate goal totals,High - Tournament's moderate-scoring nature requires momentum models calibrated for 2-3 goal scenarios as the dominant game types rather than extreme scoring,High,Identified,Calibrate momentum sensitivity for moderate-scoring games as primary tournament pattern and adjust detection thresholds for 2-3 goal optimization,
12/19/2024,Kickoff Time Analysis,"16:00 - 7 matches (smallest sample): 3.00 goals/match âš¡ Highest scoring, 42.9% draws âš¡ Most draw-prone, no goalless games",High - Afternoon kickoffs create most attacking and balanced outcomes requiring momentum models optimized for high-scoring draw scenarios,High,Identified,Develop momentum models for afternoon games with high goal threshold and draw-balance detection,
12/19/2024,Kickoff Time Analysis,"19:00 - 18 matches (substantial sample): 2.44 goals/match (moderate scoring), 33.3% draws",Medium - Prime time games show balanced momentum patterns suitable for general tournament modeling calibration,Medium,Identified,Use 19:00 games as momentum modeling baseline for balanced tournament conditions,
12/19/2024,Kickoff Time Analysis,"22:00 - 26 matches âš¡ Most scheduled: 2.00 goals/match (lowest scoring), 30.8% draws ",High - Late night games are most cautious and decisive requiring momentum models focused on defensive patterns and result separation,High,Identified,Create defensive momentum models for late games with lower scoring thresholds and decisiveness detection,
12/19/2024,Group Stage Time Distribution,"Group Stage Time Distribution: 16:00 (4 PM): 7 matches (19.4%), 19:00 (7 PM): 12 matches (33.3%), 22:00 (10 PM): 17 matches (47.2%) âš¡ Most scheduled",Medium - Group stage scheduling preferences show late-time bias requiring time-weighted momentum analysis,Medium,Identified,Weight momentum analysis by time slot frequency in group stage modeling,
12/19/2024,Group Stage Kickoff Patterns,"16:00 Group Stage: Average Goals 3.00 âš¡ Highest scoring, Draw Rate 42.9%, no goalless games",High - Afternoon group games create maximum attacking momentum requiring models optimized for high-scoring balanced outcomes,High,Identified,Develop attacking momentum models for afternoon group stage games with no defensive stalemate scenarios,
12/19/2024,Group Stage Kickoff Patterns,"19:00 Group Stage: Average Goals 2.50, Draw Rate 41.7%",Medium - Evening group games show moderate balanced patterns suitable for standard momentum modeling approaches,Medium,Identified,Use evening group games as balanced momentum reference point for model calibration,
12/19/2024,Group Stage Kickoff Patterns,"22:00 Group Stage: Average Goals 1.76 âš¡ Lowest scoring, Draw Rate 35.3% (most decisive), Zero-goal Games 17.6%, Low-scoring 47.1% (0-1 goals)",High - Late night group games are most defensive and decisive requiring momentum models focused on low-scoring patterns and defensive stalemates,High,Identified,Create defensive momentum detection for late group games with emphasis on goalless scenarios and low-scoring decisiveness,
12/19/2024,Knockout Time Distribution,"Knockout Stage Time Distribution: Round of 16: 4 matches at 19:00 + 4 matches at 22:00, Quarter-finals: 2 matches at 19:00 + 2 matches at 22:00",Medium - Knockout stage shows balanced time distribution requiring time-neutral momentum modeling for elimination pressure,Medium,Identified,Apply time-balanced momentum models for knockout stages with elimination pressure weighting,
12/19/2024,Knockout Kickoff Patterns,19:00 Knockout: no goalless games,Medium - Evening knockout games maintain attacking momentum under elimination pressure preventing defensive stalemates,Medium,Identified,Model evening knockout momentum with guaranteed goal-scoring baseline and attacking pressure maintenance,
12/19/2024,Knockout Kickoff Patterns,22:00 Knockout: Low-scoring 33.3% (0-1 goals),Medium - Late night knockout games show cautious patterns despite elimination pressure creating defensive momentum scenarios,Medium,Identified,Model late knockout momentum with defensive caution patterns despite high-stakes elimination context,
12/19/2024,Event Control Analysis,First Half > Second Half: First-half event control is more predictive (62.7% vs 45.1%),High - First half event control provides stronger momentum prediction signal than second half requiring weighted importance in models,High,Identified,Weight first-half event patterns more heavily in momentum prediction models and use as primary indicator,
12/19/2024,Stage Correlation Patterns,Knockout Accuracy: Later stages show higher event-score correlation,High - Tournament progression increases event control effectiveness requiring stage-progressive correlation modeling,High,Identified,Implement stage-specific event control models with higher sensitivity for later knockout rounds,
12/19/2024,Victory Margin Correlation,Goal Margin Matters: Bigger victories show stronger event correlation,High - Score difference amplifies event control predictive power requiring margin-weighted momentum modeling,High,Identified,Create margin-specific momentum models that scale event importance based on expected goal difference,
12/19/2024,Draw Prediction Challenge,Draw Unpredictability: Draws are hardest to predict from events (29.4% accuracy),High - Draws represent momentum equilibrium requiring specialized detection models for balanced competitive states,High,Identified,Develop draw-specific momentum models focused on equilibrium detection rather than directional advantage,
12/19/2024,Efficiency vs Volume,Clinical vs Control: Some teams win efficiently despite lower event volume,High - Clinical finishing can overcome event disadvantage requiring efficiency metrics alongside volume in momentum models,High,Identified,Include shot conversion and clinical efficiency metrics to complement event volume in momentum prediction models,
12/19/2024,Period Efficiency,Second Half Superiority: Teams are 23.4% more efficient at converting events to goals in second half,High - Second half efficiency patterns require period-specific momentum modeling with higher conversion rate expectations,High,Identified,Implement period-weighted efficiency models that account for higher second half goal conversion rates,
12/19/2024,Statistical Correlation,"Number of events -> goals, no statistical significance for first half, second half and entire game - no correlation",High - Lack of correlation between event volume and goals indicates quality over quantity in momentum modeling,High,Identified,Focus momentum models on event quality and efficiency metrics rather than pure volume-based predictors,
12/19/2024,Volume Advantage,"High Volume Advantage: Teams with >1,773 events average 1.31 goals vs 0.98 goals",Medium - Event volume threshold provides probability advantage but not prediction certainty requiring probability-based modeling,Medium,Identified,Use event volume as probability modifier rather than direct predictor in momentum models,
12/19/2024,Clinical Efficiency,"Clinical vs Volume: Some teams score efficiently (Romania: 366 events/goal) while others need massive volume (Germany vs Switzerland: 2,329 events/goal)",High - Extreme efficiency variance requires team-specific efficiency profiling in momentum prediction models,High,Identified,Develop team efficiency profiles and clinical finishing metrics to complement event volume in momentum models,
12/19/2024,Period Patterns,"First Half vs Second Half Ball Control: First half longer possessions (13.67 vs 11.79 consecutive events), fewer possessions (68.6 vs 74.8), fewer turnovers (23.73 vs 26.11) but same rate (0.347 vs 0.349)",High - Period-specific ball control patterns require different momentum modeling approaches for possession quality vs quantity,High,Identified,Create period-specific momentum models accounting for first half quality vs second half quantity patterns,
12/19/2024,Predictive Accuracy,Possessions Ratio Accuracy by Period: First half 74.5% vs Second half 52.9% - dramatic 21.6% drop in predictive power,High - First half possession patterns are significantly more predictive of final outcomes than second half requiring weighted importance,High,Identified,Weight first half possession ratios heavily in momentum models and reduce second half possession importance,
12/19/2024,Stage Predictive Patterns,Round of 16 Possession Prediction Collapse: Only 37.5% accuracy for possessions ratio,High - Knockout pressure disrupts normal possession-outcome relationships requiring stage-specific modeling adjustments,High,Identified,Develop knockout-specific momentum models that account for pressure-induced possession pattern disruption,
12/19/2024,Goal Distribution Patterns,"First Half Goal Distribution: 35.3% goalless, 37.3% single goal, 19.6% two goals - most halves have 0-1 goals (72.6%), up to 3 goals possible",High - First half goal scarcity requires momentum models calibrated for low-scoring defensive patterns and goal timing sensitivity,High,Identified,Calibrate first half momentum models for low-scoring patterns with emphasis on single goal impact and defensive stability,
12/19/2024,Goal Distribution Patterns,"Second Half Goal Distribution: More balanced with higher variety - 31.4% goalless, equal 27.5% for 1-2 goals, up to 4 goals possible",High - Second half goal variety requires momentum models adapted for multiple scoring scenarios and tactical changes,High,Identified,Develop second half momentum models accounting for increased goal variety and tactical adjustments,
12/19/2024,Period Goal Superiority,Second Half produces 25.5% more goals: +13 goals (64 vs 51) with 50% more high-scoring periods (21 vs 14 matches with 2+ goals),High - Second half goal surge requires period-weighted momentum modeling with higher scoring thresholds and tactical shift detection,High,Identified,Implement period-weighted goal expectation models that account for second half tactical intensity and scoring surge,
