match_id,minute,plus_time,minute_display,commentary_text,line_type,event_type,players_mentioned,team_focus,commentary_length
portugal_slovenia,108,0,108,"The ball goes out of play and Portugal have been awarded a corner kick.",general,Corner,,Portugal,78
portugal_slovenia,109,0,109,"Daniele Orsato blows his whistle and it's Cristiano Ronaldo (Portugal) who is penalised for an offensive foul. Good decision by the referee.",general,General,Ronaldo,Portugal,137
portugal_slovenia,110,0,110,"Benjamin Verbic (Slovenia) produces a dangerous lofted cross into the box which is intercepted.",general,General,Verbic,Slovenia,99
portugal_slovenia,111,0,111,"Daniele Orsato couldn't ignore the rough tackle by Diogo Jota (Portugal) and blew his whistle. Slovenia have a free kick from a promising distance.",general,Free Kick,Jota,Portugal,147
portugal_slovenia,111,0,111,"Roberto Martinez is stunned as referee Daniele Orsato shows him a yellow card. What was that for?",key_event,Yellow Card,Martinez,Portugal,105
portugal_slovenia,112,0,112,"Josip Ilicic (Slovenia) tries to get the ball up and over the defensive wall, but they easily block the effort.",general,Free Kick,Ilicic,Slovenia,112
portugal_slovenia,114,0,114,"Zan Celar (Slovenia) goes on a solo run, but he fails to create a chance as an opposition player blocks him.",general,General,Celar,Slovenia,117
portugal_slovenia,115,0,115,"Diogo Costa makes a brilliant save! Benjamin Sesko (Slovenia) easily weaves through the defence and unleashes a shot from just outside of the box. His effort goes towards the bottom right corner but is saved by the keeper!",key_event,Save,"Costa, Sesko",Slovenia,220
portugal_slovenia,116,0,116,"Francisco Conceicao (Portugal) crosses the ball into the box, but one of the defending players averts the threat.",general,General,Conceicao,Portugal,114
portugal_slovenia,117,0,117,"Here is a change. Joao Cancelo is going off and Roberto Martinez gives the last tactical orders to Nelson Semedo (Portugal).",key_event,Substitution,"Cancelo, Semedo, Martinez",Portugal,127
portugal_slovenia,118,0,118,"The referee stops play so that a substitution can be made and Pepe trots off the pitch and is replaced by Ruben Neves (Portugal).",key_event,Substitution,"Pepe, Neves",Portugal,131
portugal_slovenia,119,0,119,"Bruno Fernandes (Portugal) produces a quality cross into the box, but the opposition's defence intercepts the ball and spanks it away. The ball is out of play and the linesman points at the corner flag. Corner to Portugal.",general,Corner,Fernandes,Portugal,217
portugal_slovenia,120,0,120,"Bernardo Silva (Portugal) works the corner short.",general,Corner,Silva,Portugal,53
portugal_slovenia,120,0,120,"1 min. of stoppage-time to be played.",general,General,,Both,38
portugal_slovenia,120,2,120+2,"Daniele Orsato blows his whistle and ends extra time of today's match. The penalty shoot-out will determine the winner.",general,Penalty Shootout,,Both,126
portugal_slovenia,121,0,121,"It is sometimes said that a penalty kick can only be missed by the taker rather than saved by the goalkeeper. Do you think that will be in the minds of the players today?",general,Penalty Shootout,,Both,184
portugal_slovenia,121,0,121,"Diogo Costa dives to the left side of the goal and brilliantly saves the penalty taken by Josip Ilicic (Slovenia)!",key_event,Penalty Miss,"Costa, Ilicic",Slovenia,117
portugal_slovenia,121,0,121,"Cristiano Ronaldo (Portugal) gives no chance to the keeper and converts the penalty with a sharp low drive into the left side of the net.",key_event,Penalty Goal,Ronaldo,Portugal,142
portugal_slovenia,121,0,121,"Jure Balkovec (Slovenia) places the ball on the penalty spot and sends it towards the left post. His effort isn't powerful enough, allowing Diogo Costa to dive and keep the ball out with an excellent save.",key_event,Penalty Miss,"Balkovec, Costa",Slovenia,197
portugal_slovenia,121,0,121,"Goal! Bruno Fernandes (Portugal) calmly steps up and smashes the ball into the bottom left corner.",key_event,Penalty Goal,Fernandes,Portugal,104
portugal_slovenia,121,0,121,"Penalty saved! Benjamin Verbic (Slovenia) sends the penalty towards the left hand side of the goal, but Diogo Costa pulls off a wonderful save to deny him.",key_event,Penalty Miss,"Verbic, Costa",Slovenia,165
portugal_slovenia,121,0,121,"Bernardo Silva (Portugal) smoothly converts the penalty with a beautiful low drive into the right side of the goal.",key_event,Penalty Goal,Silva,Portugal,122
portugal_slovenia,121,0,121,"This is yet another match that has been decided by a dramatic penalty shootout.",key_event,Full Time,,Both,85

